smartctl 7.2 2020-12-30 r5155 [x86_64-linux-5.10.0-27-amd64] (local build)
Copyright (C) 2002-20, Bruce Allen, Christian Franke, www.smartmontools.org

=== START OF INFORMATION SECTION ===
Model Family:     Seagate IronWolf
Device Model:     ST8000VN0022-2EL112
Serial Number:    ZA1FB9FQ
LU WWN Device Id: 5 000c50 0b5e0c1ad
Firmware Version: SC61
User Capacity:    8,001,563,222,016 bytes [8.00 TB]
Sector Sizes:     512 bytes logical, 4096 bytes physical
Rotation Rate:    7200 rpm
Form Factor:      3.5 inches
Device is:        In smartctl database [for details use: -P show]
ATA Version is:   ACS-3 T13/2161-D revision 5
SATA Version is:  SATA 3.1, 6.0 Gb/s (current: 6.0 Gb/s)
Local Time is:    Sat Feb 10 16:08:48 2024 CET
SMART support is: Available - device has SMART capability.
SMART support is: Enabled

=== START OF READ SMART DATA SECTION ===
SMART overall-health self-assessment test result: PASSED

General SMART Values:
Offline data collection status:  (0x82)	Offline data collection activity
					was completed without error.
					Auto Offline Data Collection: Enabled.
Self-test execution status:      (   0)	The previous self-test routine completed
					without error or no self-test has ever 
					been run.
Total time to complete Offline 
data collection: 		(  567) seconds.
Offline data collection
capabilities: 			 (0x7b) SMART execute Offline immediate.
					Auto Offline data collection on/off support.
					Suspend Offline collection upon new
					command.
					Offline surface scan supported.
					Self-test supported.
					Conveyance Self-test supported.
					Selective Self-test supported.
SMART capabilities:            (0x0003)	Saves SMART data before entering
					power-saving mode.
					Supports SMART auto save timer.
Error logging capability:        (0x01)	Error logging supported.
					General Purpose Logging supported.
Short self-test routine 
recommended polling time: 	 (   1) minutes.
Extended self-test routine
recommended polling time: 	 ( 793) minutes.
Conveyance self-test routine
recommended polling time: 	 (   2) minutes.
SCT capabilities: 	       (0x50bd)	SCT Status supported.
					SCT Error Recovery Control supported.
					SCT Feature Control supported.
					SCT Data Table supported.

SMART Attributes Data Structure revision number: 10
Vendor Specific SMART Attributes with Thresholds:
ID# ATTRIBUTE_NAME          FLAG     VALUE WORST THRESH TYPE      UPDATED  WHEN_FAILED RAW_VALUE
  1 Raw_Read_Error_Rate     0x000f   076   064   044    Pre-fail  Always       -       36189420
  3 Spin_Up_Time            0x0003   083   083   000    Pre-fail  Always       -       0
  4 Start_Stop_Count        0x0032   100   100   020    Old_age   Always       -       83
  5 Reallocated_Sector_Ct   0x0033   100   100   010    Pre-fail  Always       -       0
  7 Seek_Error_Rate         0x000f   092   060   045    Pre-fail  Always       -       1702425452
  9 Power_On_Hours          0x0032   056   056   000    Old_age   Always       -       38974
 10 Spin_Retry_Count        0x0013   100   100   097    Pre-fail  Always       -       0
 12 Power_Cycle_Count       0x0032   100   100   020    Old_age   Always       -       83
184 End-to-End_Error        0x0032   100   100   099    Old_age   Always       -       0
187 Reported_Uncorrect      0x0032   100   100   000    Old_age   Always       -       0
188 Command_Timeout         0x0032   100   095   000    Old_age   Always       -       8
189 High_Fly_Writes         0x003a   100   100   000    Old_age   Always       -       0
190 Airflow_Temperature_Cel 0x0022   086   047   040    Old_age   Always       -       14 (Min/Max 8/27)
191 G-Sense_Error_Rate      0x0032   097   097   000    Old_age   Always       -       7737
192 Power-Off_Retract_Count 0x0032   100   100   000    Old_age   Always       -       1484
193 Load_Cycle_Count        0x0032   099   099   000    Old_age   Always       -       3941
194 Temperature_Celsius     0x0022   014   053   000    Old_age   Always       -       14 (0 3 0 0 0)
195 Hardware_ECC_Recovered  0x001a   008   001   000    Old_age   Always       -       36189420
197 Current_Pending_Sector  0x0012   100   100   000    Old_age   Always       -       0
198 Offline_Uncorrectable   0x0010   100   100   000    Old_age   Offline      -       0
199 UDMA_CRC_Error_Count    0x003e   200   200   000    Old_age   Always       -       0
240 Head_Flying_Hours       0x0000   100   253   000    Old_age   Offline      -       38763 (252 208 0)
241 Total_LBAs_Written      0x0000   100   253   000    Old_age   Offline      -       61343149220
242 Total_LBAs_Read         0x0000   100   253   000    Old_age   Offline      -       934312665487

SMART Error Log Version: 1
No Errors Logged

SMART Self-test log structure revision number 1
Num  Test_Description    Status                  Remaining  LifeTime(hours)  LBA_of_first_error
# 1  Extended offline    Completed without error       00%     38974         -
# 2  Short offline       Completed without error       00%     38960         -
# 3  Short offline       Completed without error       00%     38936         -
# 4  Short offline       Completed without error       00%     38912         -
# 5  Short offline       Completed without error       00%     38888         -
# 6  Short offline       Completed without error       00%     38864         -
# 7  Short offline       Completed without error       00%     38840         -
# 8  Short offline       Completed without error       00%     38816         -
# 9  Extended offline    Completed without error       00%     38805         -
#10  Short offline       Completed without error       00%     38792         -
#11  Short offline       Completed without error       00%     38768         -
#12  Short offline       Completed without error       00%     38744         -
#13  Short offline       Completed without error       00%     38720         -
#14  Short offline       Completed without error       00%     38696         -
#15  Short offline       Completed without error       00%     38672         -
#16  Short offline       Completed without error       00%     38648         -
#17  Extended offline    Completed without error       00%     38637         -
#18  Short offline       Completed without error       00%     38624         -
#19  Short offline       Completed without error       00%     38600         -
#20  Short offline       Completed without error       00%     38576         -
#21  Short offline       Completed without error       00%     38552         -

SMART Selective self-test log data structure revision number 1
 SPAN  MIN_LBA  MAX_LBA  CURRENT_TEST_STATUS
    1        0        0  Not_testing
    2        0        0  Not_testing
    3        0        0  Not_testing
    4        0        0  Not_testing
    5        0        0  Not_testing
Selective self-test flags (0x0):
  After scanning selected spans, do NOT read-scan remainder of disk.
If Selective self-test is pending on power-up, resume after 0 minute delay.

